Nama Makanan,Harga,Deskripsi,Gambar,Waktu Scraping
AZARINE E/BROW EYECCHIATO WARM BROWN,36.335,AZARINE E/BROW EYECCHIATO WARM BROWN,https://food-cms.grab.com/compressed_webp/items/IDITE20230926050158311068/detail/629ec3b3_36546.webp,2025-06-01 10:21:55
AZARINE E/BROW EYEPUCCINO DARK BROWN,36.335,AZARINE E/BROW EYEPUCCINO DARK BROWN,https://food-cms.grab.com/compressed_webp/items/IDITE20230926045701633376/detail/107a3021_36545.webp,2025-06-01 10:21:55
AZARINE E/LINER EYEFFOGATTO BROWN,36.335,AZARINE E/LINER EYEFFOGATTO BROWN,https://food-cms.grab.com/compressed_webp/items/IDITE20230926045744833906/detail/e7b04cf0_36549.webp,2025-06-01 10:21:55
AZARINE E/LINER EYEMERICANO BLACK,36.335,AZARINE E/LINER EYEMERICANO BLACK,https://food-cms.grab.com/compressed_webp/items/IDITE20230926045803550322/detail/c176b85f_36548.webp,2025-06-01 10:21:55
AZARINE LIP TINT CREAM PUFF,32.435,AZARINE LIP TINT CREAM PUFF,https://food-cms.grab.com/compressed_webp/items/IDITE20230926045555121943/detail/10b0dbff_36550.webp,2025-06-01 10:21:55
AZARINE LIP TINT PUMPKIN CAKE,32.435,AZARINE LIP TINT PUMPKIN CAKE,https://food-cms.grab.com/compressed_webp/items/IDITE20230926045431227876/detail/6a3ac0ca_36552.webp,2025-06-01 10:21:55
AZARINE LIP TINT STRAWBERRY PIE,32.435,AZARINE LIP TINT STRAWBERRY PIE,https://food-cms.grab.com/compressed_webp/items/IDITE20230926045838645015/detail/16fc5201_36554.webp,2025-06-01 10:21:55
AZARINE VELV LIPPIE CRM CHOCO SUN #07,36.075,AZARINE VELV LIPPIE CRM CHOCO SUN #07,https://food-cms.grab.com/compressed_webp/items/IDITE20230926050148161853/detail/b8d9ec17_37092.webp,2025-06-01 10:21:55
AZARINE VELV LIPPIE CRM CREME BRULEE #01,36.075,AZARINE VELV LIPPIE CRM CREME BRULEE #01,https://food-cms.grab.com/compressed_webp/items/IDITE20230926045648496412/detail/e8d054da_37084.webp,2025-06-01 10:21:55
AZARINE VELV LIPPIE CRM PLUM SORBET #03,36.075,AZARINE VELV LIPPIE CRM PLUM SORBET #03,https://food-cms.grab.com/compressed_webp/items/IDITE20230926045427398163/detail/45862f59_37091.webp,2025-06-01 10:21:55
AZARINE VELV LIPPIE CRM WATERMELON S #05,36.075,AZARINE VELV LIPPIE CRM WATERMELON S #05,https://food-cms.grab.com/compressed_webp/items/IDITE20230926050336145744/detail/df91b5e6_37087.webp,2025-06-01 10:21:55
BLUSH BALI 4.3 G,89.250,Blush Bali 4.3 g,https://food-cms.grab.com/compressed_webp/items/IDITE20230926050042733752/detail/6eda0685_28999.webp,2025-06-01 10:21:55
ESQA BLUSH HONOLULU,89.250,ESQA BLUSH HONOLULU,https://food-cms.grab.com/compressed_webp/items/IDITE20230926045937715575/detail/f6906e84_28997.webp,2025-06-01 10:21:55
ESQA BLUSH MILAN,89.250,ESQA BLUSH MILAN,https://food-cms.grab.com/compressed_webp/items/IDITE20230926045716473761/detail/6867041e_29000.webp,2025-06-01 10:21:55
ESQA BLUSH VIENNA,89.250,ESQA BLUSH VIENNA,https://food-cms.grab.com/compressed_webp/items/IDITE20230926045443098460/detail/2b3eca44_29001.webp,2025-06-01 10:21:55
ESQA EYESHADOW PALETE BRONZE GODDESS,146.250,ESQA EYESHADOW PALETE BRONZE GODDESS,https://food-cms.grab.com/compressed_webp/items/IDITE20230926050243587527/detail/224ff9ee_29016.webp,2025-06-01 10:21:55
ESQA EYE SHADOW PALETE MAUVE GODDESS,146.250,Esqa Eye Shadow Palete Mauve Goddess,https://food-cms.grab.com/compressed_webp/items/IDITE20230926050453501262/detail/3649d3b8_35634.webp,2025-06-01 10:21:55
ESQA EYESHADOW PALETTE PEACH GODDESS,146.250,ESQA EYESHADOW PALETTE PEACH GODDESS,https://food-cms.grab.com/compressed_webp/items/IDITE20230926050446222957/detail/e37c16c4_29018.webp,2025-06-01 10:21:55
ACNES TEA TREE OIL MASK 50GR TUBE,33.600,ACNES Tea Tree Oil Mask 50gr Tube,https://food-cms.grab.com/compressed_webp/items/6-C2CWJE2URNBKRT-C2DWJ2N3MEWFLE/detail/6e497b7e_95890.webp,2025-06-01 10:21:55
ESQA FLAWLESS MICRO SETT POWDER CARAMEL,121.500,ESQA FLAWLESS MICRO SETT POWDER CARAMEL,https://food-cms.grab.com/compressed_webp/items/IDITE20230926045721728091/detail/5766827c_29109.webp,2025-06-01 10:21:55
ESQA FLAWLESS MICRO SETT POWDER CUSTARD,121.500,ESQA FLAWLESS MICRO SETT POWDER CUSTARD,https://food-cms.grab.com/compressed_webp/items/IDITE20230926050448284880/detail/e79bdc52_29020.webp,2025-06-01 10:21:55
ESQA FLAWLESS POWDER FOUNDATION BISCUIT,121.500,Esqa Flawless Powder Foundation Biscuit,https://food-cms.grab.com/compressed_webp/items/IDITE20230926045654579711/detail/1c49b1e7_31440.webp,2025-06-01 10:21:55
ESQA FLAWLESS POWDER FOUNDATION CARAMEL 6.5 G,121.500,ESQA Flawless Powder Foundation Caramel 6.5 g,https://food-cms.grab.com/compressed_webp/items/IDITE20230926045656384034/detail/00583f57_29025.webp,2025-06-01 10:21:55
ESQA FLAWLESS POWDER FOUNDATION CUSTARD 6.5 G,121.500,ESQA Flawless Powder Foundation Custard 6.5 g,https://food-cms.grab.com/compressed_webp/items/IDITE20230926045733657576/detail/40e65fae_29024.webp,2025-06-01 10:21:55
ESQA FLAWLESS POWDER FOUNDATION GRANOLA,121.500,Esqa Flawless Powder Foundation Granola,https://food-cms.grab.com/compressed_webp/items/IDITE20230926050527065151/detail/1c54532f_31439.webp,2025-06-01 10:21:55
ESQA FLAWLESS POWDER FOUNDATION VANILLA 6.5 G,121.500,ESQA Flawless Powder Foundation Vanilla 6.5 g,https://food-cms.grab.com/compressed_webp/items/IDITE20230926050522558836/detail/b50e7a89_29022.webp,2025-06-01 10:21:55
ESQA FLAWLESS SETT POWDER TRANSLUCENT,121.500,ESQA FLAWLESS SETT POWDER TRANSLUCENT,https://food-cms.grab.com/compressed_webp/items/IDITE20230926050136351145/detail/d5c94151_29021.webp,2025-06-01 10:21:55
ESQA FLAWLESS SETT POWDER VANILLA,121.500,ESQA FLAWLESS SETT POWDER VANILLA,https://food-cms.grab.com/compressed_webp/items/IDITE20230926050018392681/detail/ddc404b9_29019.webp,2025-06-01 10:21:55
ESQA FREEZE BROW MASCARA CLEAR,127.500,ESQA FREEZE BROW MASCARA CLEAR,https://food-cms.grab.com/compressed_webp/items/IDITE20230926050406183548/detail/6c5074ae_29015.webp,2025-06-01 10:21:55
ESQA FREEZE TINT BROW MASCARA ASH BROWN,127.500,ESQA FREEZE TINT BROW MASCARA ASH BROWN,https://food-cms.grab.com/compressed_webp/items/IDITE20230926045912495929/detail/808d1c1e_29014.webp,2025-06-01 10:21:55
ESQA FREEZE TINT BROW MASCARA DARK BROWN,127.500,ESQA FREEZE TINT BROW MASCARA DARK BROWN,https://food-cms.grab.com/compressed_webp/items/IDITE20230926045717708359/detail/2743634e_29013.webp,2025-06-01 10:21:55
ESQA MIST UNIVERSE SETTING SPRAY 100 ML,123.250,ESQA Mist Universe Setting Spray 100 ml,https://food-cms.grab.com/compressed_webp/items/IDITE20230926050024708666/detail/4b7e17f0_29038.webp,2025-06-01 10:21:55
WATERPROOF INTENSE EYELINER BLACK 1 ML,106.250,Waterproof Intense Eyeliner Black 1 ml,https://food-cms.grab.com/compressed_webp/items/IDITE20230926045951344983/detail/3b6d3374_28996.webp,2025-06-01 10:21:55
BIODERMA HYDRABIO H2O MICELLAR WATER 250ML,244.400,BIODERMA Hydrabio H2O Micellar Water 250ml,https://food-cms.grab.com/compressed_webp/items/IDITE20210617182753064784/detail/f5864344_55266.webp,2025-06-01 10:21:55
ESQA WATERPROOF INTENSE EYELINER CHAI 1ML,106.250,Esqa Waterproof Intense Eyeliner Chai 1Ml,https://food-cms.grab.com/compressed_webp/items/IDITE20230926050202343958/detail/091cb9a7_36543.webp,2025-06-01 10:21:55
BIODERMA SEBIUM FOAMING GEL 100ML,137.900,BIODERMA Sebium Foaming Gel 100ml,https://food-cms.grab.com/compressed_webp/items/6-C2CWJE2URNBKRT-C2C1AXX2SBUYN6/detail/7d89454e_54150.webp,2025-06-01 10:21:55
BIODERMA SEBIUM H2O 100ML,128.900,BIODERMA Sebium H2O 100ml,https://food-cms.grab.com/compressed_webp/items/IDITE20210617182751040835/detail/0d569f06_54147.webp,2025-06-01 10:21:55
BIODERMA SEBIUM H2O 250ML,244.400,BIODERMA Sebium H2O 250ml,https://food-cms.grab.com/compressed_webp/items/IDITE20210617182751075197/detail/c5e390f5_54148.webp,2025-06-01 10:21:55
BIODERMA SEBIUM KERATO+ 30ML,237.900,Bioderma Sebium Kerato+ 30ml,https://food-cms.grab.com/compressed_webp/items/IDITE20211202063339621704/detail/f73c22fc_37117.webp,2025-06-01 10:21:55
BIODERMA SENSIBIO H2O 100ML,128.900,BIODERMA Sensibio H2O 100ml,https://food-cms.grab.com/compressed_webp/items/IDITE20210617182759046084/detail/9dfd8f4f_54135.webp,2025-06-01 10:21:55
BIODERMA SENSIBIO H2O 250ML,244.400,BIODERMA Sensibio H2O 250ml,https://food-cms.grab.com/compressed_webp/items/IDITE20210617182750050356/detail/330a8eeb_54136.webp,2025-06-01 10:21:55
BIODERMA SENSIBIO H2O 500ML,376.000,BIODERMA Sensibio H2O 500ml,https://food-cms.grab.com/compressed_webp/items/IDITE20210617182750071445/detail/ca356243_54137.webp,2025-06-01 10:21:55
BIODERMA SENSIBIO H2O EYE BIPHASE MICELLAIRE 125ML,153.200,BIODERMA Sensibio H2O Eye Biphase Micellaire 125ml,https://food-cms.grab.com/compressed_webp/items/IDITE20230704235344195380/detail/a0045b04_29443.webp,2025-06-01 10:21:55
BIODERMA SENSIBIO GEL MOUSSANT 100ML,137.900,BIODERMA Sensibio Gel Moussant 100ml,https://food-cms.grab.com/compressed_webp/items/6-C2CWJE2URNBKRT-C2C1LX32VVAALJ/detail/b7c4229c_18548.webp,2025-06-01 10:21:55
BIORE MAKE UP REMOVER CLEANSING OIL PUMP 150ML,89.500,BIORE Make Up Remover Cleansing Oil Pump 150ml,https://food-cms.grab.com/compressed_webp/items/IDITE20210617182746020890/detail/80cb7f10_52845.webp,2025-06-01 10:21:55
L'ORÉAL PARIS INFALLIBLE 24H FRESH WEAR POWDER FOUNDATION 020 IVORY,116.900,L'Oréal Paris Infallible 24h Fresh Wear Powder Foundation 020 Ivory,https://food-cms.grab.com/compressed_webp/items/IDITE20230525014559096951/detail/96c68fc0_31428.webp,2025-06-01 10:21:55
L'ORÉAL PARIS INFALLIBLE 24H FRESH WEAR POWDER FOUNDATION 120 VANILLA,116.900,L'Oréal Paris Infallible 24h Fresh Wear Powder Foundation 120 Vanilla,https://food-cms.grab.com/compressed_webp/items/IDITE20230525014543063821/detail/f68c0a80_31429.webp,2025-06-01 10:21:55
L'ORÉAL PARIS INFALLIBLE 24H FRESH WEAR POWDER FOUNDATION 130 TRUE BEIGE,116.900,L'Oréal Paris Infallible 24h Fresh Wear Powder Foundation 130 True Beige,https://food-cms.grab.com/compressed_webp/items/IDITE20230525014516113141/detail/ee1cb6f7_31430.webp,2025-06-01 10:21:55
L'ORÉAL PARIS INFALLIBLE 24H FRESH WEAR POWDER FOUNDATION 140 GOLDEN BEIGE,116.900,L'Oréal Paris Infallible 24h Fresh Wear Powder Foundation 140 Golden Beige,https://food-cms.grab.com/compressed_webp/items/IDITE20230525014604096217/detail/81f5eaec_31431.webp,2025-06-01 10:21:55
L'ORÉAL PARIS INFALLIBLE 24H FRESH WEAR POWDER FOUNDATION 220 SAND,116.900,L'Oréal Paris Infallible 24h Fresh Wear Powder Foundation 220 Sand,https://food-cms.grab.com/compressed_webp/items/IDITE20230525014831254163/detail/09edb92c_31432.webp,2025-06-01 10:21:55
L'ORÉAL PARIS INFALLIBLE 24H FRESH WEAR POWDER FOUNDATION 245 GOLDEN HONEY,116.900,L'Oréal Paris Infallible 24h Fresh Wear Powder Foundation 245 Golden Honey,https://food-cms.grab.com/compressed_webp/items/IDITE20230525014512093105/detail/292bb751_31433.webp,2025-06-01 10:21:55
L'OREAL PARIS INFALLIBLE 32H MATTE COVER FOUNDATION 110 - COOL UNDERTONE,149.400,L'Oreal Paris Infallible 32H Matte Cover Foundation 110 - Cool Undertone,https://food-cms.grab.com/compressed_webp/items/IDITE20230926050300189254/detail/4fc1e649_35968.webp,2025-06-01 10:21:55
L'OREAL PARIS INFALLIBLE 32H MATTE COVER FOUNDATION 123 - COOL UNDERTONE,149.400,L'Oreal Paris Infallible 32H Matte Cover Foundation 123 - Cool Undertone,https://food-cms.grab.com/compressed_webp/items/IDITE20230926050237126451/detail/b51b5a6a_35970.webp,2025-06-01 10:21:55
L'OREAL PARIS INFALLIBLE 32H MATTE COVER FOUNDATION 125 - WARM UNDERTONE,149.400,L'Oreal Paris Infallible 32H Matte Cover Foundation 125 - Warm Undertone,https://food-cms.grab.com/compressed_webp/items/IDITE20230926045448351339/detail/7e2ab383_35971.webp,2025-06-01 10:21:55
L'OREAL PARIS INFALLIBLE 32H MATTE COVER FOUNDATION 128- NEUTRAL UNDERTONE,149.400,L'Oreal Paris Infallible 32H Matte Cover Foundation 128- Neutral Undertone,https://food-cms.grab.com/compressed_webp/items/IDITE20230926045848092396/detail/ffa824da_36002.webp,2025-06-01 10:21:55
L'OREAL PARIS INFALLIBLE 32H MATTE COVER FOUNDATION 140 - NEUTRAL UNDERTONE,149.400,L'Oreal Paris Infallible 32H Matte Cover Foundation 140 - Neutral Undertone,https://food-cms.grab.com/compressed_webp/items/IDITE20230926050156112824/detail/5bf33c12_36003.webp,2025-06-01 10:21:55
L'OREAL PARIS INFALLIBLE 32H MATTE COVER FOUNDATION 147 - COOL UNDERTONE,149.400,L'Oreal Paris Infallible 32H Matte Cover Foundation 147 - Cool Undertone,https://food-cms.grab.com/compressed_webp/items/IDITE20230926045950248985/detail/64008315_35972.webp,2025-06-01 10:21:55
L'OREAL PARIS INFALLIBLE 32H MATTE COVER FOUNDATION 240 - WARM UNDERTONE,149.400,L'Oreal Paris Infallible 32H Matte Cover Foundation 240 - Warm Undertone,https://food-cms.grab.com/compressed_webp/items/IDITE20230926045540933744/detail/e5483fe2_35973.webp,2025-06-01 10:21:55
L'OREAL PARIS INFALLIBLE 32H MATTE COVER FOUNDATION 250 - WARM UNDERTONE,149.400,L'Oreal Paris Infallible 32H Matte Cover Foundation 250 - Warm Undertone,https://food-cms.grab.com/compressed_webp/items/IDITE20230926045646523676/detail/2a0e04b7_35974.webp,2025-06-01 10:21:55
L'OREAL PARIS INFALLIBLE 32H MATTE COVER FOUNDATION 30 - NEUTRAL UNDERTONE,149.400,L'Oreal Paris Infallible 32H Matte Cover Foundation 30 - Neutral Undertone,https://food-cms.grab.com/compressed_webp/items/IDITE20230926045939110025/detail/eba8504f_35976.webp,2025-06-01 10:21:55
CERAVE AM FACIAL MOIST LOTION SPF30 52ML,232.200,CERAVE AM FACIAL MOI,https://food-cms.grab.com/compressed_webp/items/IDITE20240213235037191113/detail/c001550c_38637.webp,2025-06-01 10:21:55
CERAVE FOAMING CLEANSER 236ML,178.700,CERAVE FOAMING CLEAN,https://food-cms.grab.com/compressed_webp/items/IDITE20240213234949257021/detail/b8c893fc_38638.webp,2025-06-01 10:21:55
CERAVE FOAMING CLEANSER 473ML,248.300,CERAVE FOAMING CLEAN,https://food-cms.grab.com/compressed_webp/items/IDITE20240213235001072822/detail/bb315e3f_38640.webp,2025-06-01 10:21:55
CERAVE FOAMING CLEANSER 88ML,104.400,CERAVE FOAMING CLEAN,https://food-cms.grab.com/compressed_webp/items/IDITE20240213235013131778/detail/5eb66a80_38639.webp,2025-06-01 10:21:55
CERAVE HYDRATING CLEANSER 236ML,163.500,CERAVE HYDRATING CLE,https://food-cms.grab.com/compressed_webp/items/IDITE20240213235036117651/detail/6681ae04_38641.webp,2025-06-01 10:21:55
CERAVE HYDRATING CLEANSER 473ML,259.700,CERAVE HYDRATING CLE,https://food-cms.grab.com/compressed_webp/items/IDITE20240213235016067443/detail/6e879771_38643.webp,2025-06-01 10:21:55
CERAVE HYDRATING CLEANSER 88ML,91.200,CERAVE HYDRATING CLE,https://food-cms.grab.com/compressed_webp/items/IDITE20240213234956213314/detail/41d04041_38642.webp,2025-06-01 10:21:55
CERAVE PM FACIAL MOISTRZNG LOTION 52ML,233.100,CERAVE PM FACIAL MOI,https://food-cms.grab.com/compressed_webp/items/IDITE20240213235021063397/detail/b23371ae_38649.webp,2025-06-01 10:21:55
CETAPHIL SKIN RENEWING CLEANSER GEL 100GR,156.200,Cetaphil Skin Renewing Cleanser Gel 100gr,https://food-cms.grab.com/compressed_webp/items/IDITE20211202063237089132/detail/e6f2f74e_35435.webp,2025-06-01 10:21:55
CETAPHIL BRIGHT HEALTHY RADIANCE PERFECTING SERUM 30ML,303.100,Cetaphil Bright Healthy Radiance Perfecting Serum 30ml,https://food-cms.grab.com/compressed_webp/items/IDITE20211202062802897575/detail/f11f4320_35432.webp,2025-06-01 10:21:55
CETAPHIL BRIGHT HEALTHY RADIANCE - BRIGHTENING DAY PROTECTION CREAM SPF 50ML,206.500,CETAPHIL Bright Healthy Radiance - Brightening Day Protection Cream SPF 50ml,https://food-cms.grab.com/compressed_webp/items/IDITE20210617182542038217/detail/57b389be_18464.webp,2025-06-01 10:21:55
CETAPHIL BRIGHT HEALTHY RADIANCE - BRIGHTENING NIGHT COMFORT CREAM 50ML,214.400,CETAPHIL Bright Healthy Radiance - Brightening Night Comfort Cream 50ml,https://food-cms.grab.com/compressed_webp/items/IDITE20210617182549056047/detail/84594ae9_18461.webp,2025-06-01 10:21:55
CETAPHIL BRIGHT HEALTHY RADIANCE - BRIGHTNESS REFRESH TONER 150ML,159.000,CETAPHIL Bright Healthy Radiance - Brightness Refresh Toner 150ml,https://food-cms.grab.com/compressed_webp/items/IDITE20210617182547055458/detail/18deae38_18462.webp,2025-06-01 10:21:55
CETAPHIL BRIGHT HEALTHY RADIANCE - BRIGHTNESS REVEAL CREAMY CLEANSER 100ML,164.100,CETAPHIL Bright Healthy Radiance - Brightness Reveal Creamy Cleanser 100ml,https://food-cms.grab.com/compressed_webp/items/6-C2CWJE2URNBKRT-C2DWJ2JWR72FTX/detail/47e1dcbc_18463.webp,2025-06-01 10:21:55
CETAPHIL DAILY EXFOLIATING CLEANSER 178ML,99.400,CETAPHIL Daily Exfoliating Cleanser 178ml,https://food-cms.grab.com/compressed_webp/items/IDITE20210617183431081357/detail/0e162873_15813.webp,2025-06-01 10:21:55
CITRA NATURAL BOOSTER BODY SERUM FRESH GLOW WITH 20X NIACINAMIDE,24.000,Citra Natural Booster Body Serum Fresh Glow with 20X Niacinamide,https://food-cms.grab.com/compressed_webp/items/IDITE20211202063025173933/detail/b0f9d218_14676.webp,2025-06-01 10:21:55
COSRX ADVANCED SNAIL 92 ALL IN ONE CREAM 100ML,219.300,COSRX Advanced Snail 92 All in One Cream 100ml,https://food-cms.grab.com/compressed_webp/items/IDITE20210617183441072296/detail/6b153772_50445.webp,2025-06-01 10:21:55
COSRX AHA/BHA CLARIFYING TREATMENT TONER 150ML,133.100,COSRX AHA/BHA Clarifying Treatment Toner 150ml,https://food-cms.grab.com/compressed_webp/items/IDITE20210617183547121088/detail/b14e9ea3_58621.webp,2025-06-01 10:21:55
COSRX ALOE SOOTHING SUN CREAM SPF 50 PA+++ 50ML,171.300,COSRX Aloe Soothing Sun Cream SPF 50 PA+++ 50ml,https://food-cms.grab.com/compressed_webp/items/IDITE20211202063422138078/detail/3f59a5a4_50849.webp,2025-06-01 10:21:55
COSRX OIL-FREE ULTRA-MOISTURIZING LOTION WITH BIRCH SAP 100ML,231.300,COSRX Oil-Free Ultra-Moisturizing Lotion with Birch Sap 100ml,https://food-cms.grab.com/compressed_webp/items/IDITE20210617183552011215/detail/d13268c4_58765.webp,2025-06-01 10:21:55
COSRX SALICYLIC ACID DAILY GENTLE CLEANSER 150ML,103.600,COSRX Salicylic Acid Daily Gentle Cleanser 150ml,https://food-cms.grab.com/compressed_webp/items/6-C2CWJE2URNBKRT-C2C1LYBXFEUFCN/detail/5f25a64e_58620.webp,2025-06-01 10:21:55
COSRX CENTELLA WATER ALCOHOL-FREE TONER 150ML,182.700,COSRX Centella Water Alcohol-Free Toner 150ml,https://food-cms.grab.com/compressed_webp/items/IDITE20210617183424056654/detail/16cdea51_50441.webp,2025-06-01 10:21:55
COSRX LOW PH GOOD MORNING GEL CLEANSER 150ML,119.600,COSRX Low pH Good Morning Gel Cleanser 150ml,https://food-cms.grab.com/compressed_webp/items/IDITE20210617183546043050/detail/e7f84293_58498.webp,2025-06-01 10:21:55
COSRX FULL FIT PROPOLIS SYNERGY TONER 150ML,177.500,COSRX Full Fit Propolis Synergy Toner 150ml,https://food-cms.grab.com/compressed_webp/items/6-C2CWJE2URNBKRT-C2C1AXW3UGEEN2/detail/c0505d20_18016.webp,2025-06-01 10:21:55
DAP ACNE SKIN TONER CLEAR LOTION 100ML,74.900,DAP ACNE SKIN TONER CLEAR LOTION 100ML,https://food-cms.grab.com/compressed_webp/items/IDITE20230704235723274956/detail/681421c7_29135.webp,2025-06-01 10:21:55
DAP ACNE WHIPPED MOUSSE FCL FOAM 100ML,34.900,DAP ACNE WHIPPED MOUSSE FCL FOAM 100ML,https://food-cms.grab.com/compressed_webp/items/IDITE20230704235336742431/detail/89ba47e7_29133.webp,2025-06-01 10:21:55
L'OREAL DERMATOLOGIST GENTLE LIP & EYE MAKE UP REMOVER 125ML,118.800,L'OREAL Dermatologist Gentle Lip & Eye Make Up Remover 125ml,https://food-cms.grab.com/compressed_webp/items/IDITE20211202063313618523/detail/c46aa6b1_41920.webp,2025-06-01 10:21:55
L'OREAL DEX HYALURONIC ACID DAY CREAM 50ML,214.200,L'Oreal DEX Hyaluronic Acid Day Cream 50ml,https://food-cms.grab.com/compressed_webp/items/IDITE20230704235744588440/detail/44dd5eca_20576.webp,2025-06-01 10:21:55
ERHA AGE CORRECTOR ACTIVE DEFENSE BOOSTER 15 ML,174.200,ERHA Age Corrector Active Defense Booster 15 ml,https://food-cms.grab.com/compressed_webp/items/IDITE20211202063029818574/detail/0a9ebdad_19988.webp,2025-06-01 10:21:55
ERHA AGE CORRECTOR EYE SERUM 15G,151.200,ERHA Age Corrector Eye Serum 15g,https://food-cms.grab.com/compressed_webp/items/IDITE20230525014331076355/detail/f39668dc_28387.webp,2025-06-01 10:21:55
ERHA TRUWHITE EYE SERUM 15 ML,152.800,ERHA TRUWHITE EYE SERUM 15 ML,https://food-cms.grab.com/compressed_webp/items/IDITE20211202063440076710/detail/ab97306e_25418.webp,2025-06-01 10:21:55
ERHA TRUWHITE MILK ESSENCE 100ML,133.600,ERHA TRUWHITE MILK ESSENCE 100ML,https://food-cms.grab.com/compressed_webp/items/IDITE20210617182551081255/detail/d49525da_29385.webp,2025-06-01 10:21:55
MAYBELLINE CONCEALER INSTANT AGE REWIND 120,101.300,MAYBELLINE Concealer Instant Age Rewind 120,https://food-cms.grab.com/compressed_webp/items/IDITE20210617182655055524/detail/89dbbebc_81894.webp,2025-06-01 10:21:55
MAYBELLINE CONCEALER INSTANT AGE REWIND 130,101.300,MAYBELLINE Concealer Instant Age Rewind 130,https://food-cms.grab.com/compressed_webp/items/IDITE20210617182655084493/detail/22db0c01_81895.webp,2025-06-01 10:21:55
MAYBELLINE DEFINE AND BLEND MECHANIC EYEBROW PENCIL GREY BROWN,55.100,MAYBELLINE Define and Blend Mechanic Eyebrow Pencil Grey Brown,https://food-cms.grab.com/compressed_webp/items/IDITE20210617182653046586/detail/3ea37e0f_84124.webp,2025-06-01 10:21:55
MAYBELLINE DEFINE AND BLEND MECHANIC EYEBROW PENCIL NATURAL BROWN,55.100,MAYBELLINE Define and Blend Mechanic Eyebrow Pencil Natural Brown,https://food-cms.grab.com/compressed_webp/items/IDITE20210617182653038162/detail/4543c884_84123.webp,2025-06-01 10:21:55
MAYBELLINE HYPERSHARP EXTREME LIQUID EYELINER WATERPROOF EYELINER HITAM,103.900,Maybelline Hypersharp Extreme Liquid Eyeliner Waterproof Eyeliner Hitam,https://food-cms.grab.com/compressed_webp/items/IDITE202307042350091060096/detail/6b099a7e_26935.webp,2025-06-01 10:21:55
MAYBELLINE HYPERSHARP EXTREME LIQUID EYELINER WATERPROOF EYELINER COKELAT,103.900,Maybelline Hypersharp Extreme Liquid Eyeliner Waterproof Eyeliner Cokelat,https://food-cms.grab.com/compressed_webp/items/IDITE20230704235006013198/detail/17cac180_26936.webp,2025-06-01 10:21:55
MAYBELLINE LIP & EYE MAKEUP REMOVER 150 ML,94.800,Maybelline Lip & Eye Makeup Remover 150 ml,https://food-cms.grab.com/compressed_webp/items/IDITE20230926045935246667/detail/34693c76_36376.webp,2025-06-01 10:21:55
GARNIER SKIN NATURALS LIGHT COMPLETE WHITE SPEED YOGHURT SLEEPING MASK 50ML,78.400,GARNIER Skin Naturals Light Complete White Speed Yoghurt Sleeping Mask 50ml,https://food-cms.grab.com/compressed_webp/items/IDITE20211202063122646242/detail/0f43dfb0_57055.webp,2025-06-01 10:21:55
IMEW MOIST TONER SOOTHE AND ENERGISE 100ML,44.900,Imew Moist Toner Soothe and Energise 100Ml,https://food-cms.grab.com/compressed_webp/items/IDITE20211202063443181029/detail/d26cc14c_27550.webp,2025-06-01 10:21:55
WATSONS ELBOW ADJUSTABLE SUPPORT,26.900,WATSONS ELBOW ADJUSTABLE SUPPORT,https://food-cms.grab.com/compressed_webp/items/IDITE20230704234427411001/detail/49041ea1_16960.webp,2025-06-01 10:21:55
IMEW AQUA JELLY CLEANSER 125ML,38.900,Imew Aqua Jelly Cleanser 125Ml,https://food-cms.grab.com/compressed_webp/items/IDITE20230525014341053314/detail/d58bc984_27545.webp,2025-06-01 10:21:55
IMEW NIACINAMIDE BOOSTER SERUM 30ML,59.900,Imew Niacinamide Booster Serum 30Ml,https://food-cms.grab.com/compressed_webp/items/IDITE20230525014345132325/detail/69490f60_27557.webp,2025-06-01 10:21:55
IMEW MOIST WHIPPED CREAM 50ML,59.900,Imew Moist Whipped Cream 50Ml,https://food-cms.grab.com/compressed_webp/items/IDITE20211202063251324800/detail/44101f22_27553.webp,2025-06-01 10:21:55
IMEW BAKUCHIOL BOOSTER SERUM 30ML,59.900,Imew Bakuchiol Booster Serum 30Ml,https://food-cms.grab.com/compressed_webp/items/IDITE20211202063336186437/detail/2e3fb888_27558.webp,2025-06-01 10:21:55
WATSONS VERY HIGH PROTECTION SUNSCREEN ALOE FACE BODY LOTION SPF50+ PA++++ 100M,34.900,WATSONS VERY HIGH PROTECTION SUNSCREEN ALOE FACE BODY LOTION SPF50+ PA++++ 100ML,https://food-cms.grab.com/compressed_webp/items/IDITE20230704234216742692/detail/5493dbe5_27315.webp,2025-06-01 10:21:55
WATSONS OVAL STYLING HAIR BRUSH,29.900,WATSONS OVAL STYLING HAIR BRUSH,https://food-cms.grab.com/compressed_webp/items/IDITE20230704233013520860/detail/b9800189_56647.webp,2025-06-01 10:21:55
AKURAT COMPACT,29.000,AKURAT COMPACT,https://food-cms.grab.com/compressed_webp/items/IDITE20210617183058082375/detail/58a5cf85_47412.webp,2025-06-01 10:21:55
SENSITIF AKURAT TEST KEHAMILAN STRIP,16.000,SENSITIF AKURAT TEST KEHAMILAN STRIP,https://food-cms.grab.com/compressed_webp/items/IDITE202109011301251015407/detail/641a1e82_11330.webp,2025-06-01 10:21:55
DUREX CLOSE FIT 3SACHET,28.900,DUREX CLOSE FIT 3SACHET,https://food-cms.grab.com/compressed_webp/items/IDITE20210617183213124907/detail/ce0b56a2_11261.webp,2025-06-01 10:21:55
DUREX EXTRA SAFE 12SACHET,125.900,DUREX EXTRA SAFE 12SACHET,https://food-cms.grab.com/compressed_webp/items/IDITE20210617183747026994/detail/3c98ab89_11256.webp,2025-06-01 10:21:55
DUREX EXTRA SAFE 3S - KONDOM TEBAL LELAKI,29.900,DUREX EXTRA SAFE 3S - KONDOM TEBAL LELAKI,https://food-cms.grab.com/compressed_webp/items/IDITE20210617183213060014/detail/d28b125e_11255.webp,2025-06-01 10:21:55
DUREX FETHERLITE 12S - KONDOM TIPIS,129.900,DUREX FETHERLITE 12S - KONDOM TIPIS,https://food-cms.grab.com/compressed_webp/items/IDITE20210617183759050703/detail/8fb603db_11253.webp,2025-06-01 10:21:55
DUREX FETHERLITE 3S - KONDOM TIPIS,45.900,DUREX FETHERLITE 3S - KONDOM TIPIS,https://food-cms.grab.com/compressed_webp/items/IDITE20210617183213032162/detail/e5e967af_11252.webp,2025-06-01 10:21:55
DUREX INVISIBLE EXTRA THIN 2S,64.500,DUREX INVISIBLE EXTRA THIN 2S,https://food-cms.grab.com/compressed_webp/items/IDITE20210617183029054796/detail/2bde6dee_24286.webp,2025-06-01 10:21:55
DUREX MASSAGE 2 IN 1 200ML,214.900,DUREX MASSAGE 2 IN 1 200ML,https://food-cms.grab.com/compressed_webp/items/IDITE20210617183033173673/detail/95fbedce_46312.webp,2025-06-01 10:21:55
DUREX KONDOM MUTUAL PLEASURE 12S,209.900,DUREX KONDOM MUTUAL PLEASURE 12S,https://food-cms.grab.com/compressed_webp/items/IDITE202307042329181131005/detail/06a5c0e5_21933.webp,2025-06-01 10:21:55
DUREX PERFORMA 3S - KONDOM TAHAN LAMA,35.900,DUREX PERFORMA 3S - KONDOM TAHAN LAMA,https://food-cms.grab.com/compressed_webp/items/IDITE20210617183213091458/detail/582576bd_11257.webp,2025-06-01 10:21:55
